{
  "protocol_version": "1.0",
  "forms_lang_version": "1.2.2",
  "source_commit": "22f24805d0f8b277368723306565b94c5e2d25b0",
  "generated_at": "2026-09-18T20:51:28.878568+00:00",
  "engine_path": "formslang.parser.parse_xml -> formslang.blueprint.build",
  "predictions": [
    {
      "finding_id": "alert:5456336d8d873b03fabd143c",
      "status": "PREDICTED",
      "source": {
        "file": "APPROVALS.xml",
        "module": "APPROVALS",
        "block": null,
        "item": null,
        "trigger": null,
        "procedure": null
      },
      "classification": "MANUAL_REVIEW",
      "risk": "UNKNOWN",
      "verdict": "UNKNOWN",
      "evidence": [
        "evidence:17aaf9cfe95065fe8f92ddf3"
      ],
      "raw_output_ref": "alert:5456336d8d873b03fabd143c",
      "notes": "A reference alone cannot establish implementation, ownership or safe reuse."
    },
    {
      "finding_id": "alert:6f93ab0fa1b488e794b94a87",
      "status": "PREDICTED",
      "source": {
        "file": "ORDERS.xml",
        "module": "ORDERS",
        "block": null,
        "item": null,
        "trigger": null,
        "procedure": null
      },
      "classification": "MANUAL_REVIEW",
      "risk": "UNKNOWN",
      "verdict": "UNKNOWN",
      "evidence": [
        "evidence:5446f08c2b088ab897a70e7e"
      ],
      "raw_output_ref": "alert:6f93ab0fa1b488e794b94a87",
      "notes": "A reference alone cannot establish implementation, ownership or safe reuse."
    },
    {
      "finding_id": "alert:b24c394d72ac21fa2bb08b56",
      "status": "PREDICTED",
      "source": {
        "file": "APPROVALS.xml",
        "module": "APPROVALS",
        "block": null,
        "item": null,
        "trigger": null,
        "procedure": null
      },
      "classification": "MANUAL_REVIEW",
      "risk": "UNKNOWN",
      "verdict": "UNKNOWN",
      "evidence": [
        "evidence:397b85f41ba2fcc531013bfd"
      ],
      "raw_output_ref": "alert:b24c394d72ac21fa2bb08b56",
      "notes": "A reference alone cannot establish implementation, ownership or safe reuse."
    },
    {
      "finding_id": "alert:be01d2a24cc2db918b9a83c8",
      "status": "PREDICTED",
      "source": {
        "file": "ORDERS.xml",
        "module": "ORDERS",
        "block": null,
        "item": null,
        "trigger": null,
        "procedure": null
      },
      "classification": "MANUAL_REVIEW",
      "risk": "UNKNOWN",
      "verdict": "UNKNOWN",
      "evidence": [
        "evidence:f44495927e533fdf86d3d072"
      ],
      "raw_output_ref": "alert:be01d2a24cc2db918b9a83c8",
      "notes": "A reference alone cannot establish implementation, ownership or safe reuse."
    },
    {
      "finding_id": "alert:fb18bf7687a8a3e2ca484d90",
      "status": "PREDICTED",
      "source": {
        "file": "CUSTOMERS.xml",
        "module": "CUSTOMERS",
        "block": null,
        "item": null,
        "trigger": null,
        "procedure": null
      },
      "classification": "MANUAL_REVIEW",
      "risk": "UNKNOWN",
      "verdict": "UNKNOWN",
      "evidence": [
        "evidence:e1b78b9955492c29a5a9f589"
      ],
      "raw_output_ref": "alert:fb18bf7687a8a3e2ca484d90",
      "notes": "A reference alone cannot establish implementation, ownership or safe reuse."
    },
    {
      "finding_id": "bind_reference:40a27b52c0d3e3684120d0a7",
      "status": "PREDICTED",
      "source": {
        "file": "INVENTORY.xml",
        "module": "INVENTORY",
        "block": null,
        "item": null,
        "trigger": null,
        "procedure": null
      },
      "classification": "MANUAL_REVIEW",
      "risk": "UNKNOWN",
      "verdict": "UNKNOWN",
      "evidence": [
        "evidence:27744682cdfd1c7145cc4224",
        "evidence:8cad038322b41b56ef94d6f2"
      ],
      "raw_output_ref": "bind_reference:40a27b52c0d3e3684120d0a7",
      "notes": "A reference alone cannot establish implementation, ownership or safe reuse."
    },
    {
      "finding_id": "bind_reference:609b23a6f86b4e736cfa6b7f",
      "status": "PREDICTED",
      "source": {
        "file": "INVENTORY.xml",
        "module": "INVENTORY",
        "block": null,
        "item": null,
        "trigger": null,
        "procedure": null
      },
      "classification": "MANUAL_REVIEW",
      "risk": "UNKNOWN",
      "verdict": "UNKNOWN",
      "evidence": [
        "evidence:7ab95238670d14a560bed323",
        "evidence:a3cab0c1a3390309d7db5fa1"
      ],
      "raw_output_ref": "bind_reference:609b23a6f86b4e736cfa6b7f",
      "notes": "A reference alone cannot establish implementation, ownership or safe reuse."
    },
    {
      "finding_id": "bind_reference:65ce24b465bda7a5037ea8e6",
      "status": "PREDICTED",
      "source": {
        "file": "APPROVALS.xml",
        "module": "APPROVALS",
        "block": null,
        "item": null,
        "trigger": null,
        "procedure": null
      },
      "classification": "MANUAL_REVIEW",
      "risk": "UNKNOWN",
      "verdict": "UNKNOWN",
      "evidence": [
        "evidence:a146eb6a0ab836f3fbd78b7d",
        "evidence:d1e7922445123f87cc955395"
      ],
      "raw_output_ref": "bind_reference:65ce24b465bda7a5037ea8e6",
      "notes": "A reference alone cannot establish implementation, ownership or safe reuse."
    },
    {
      "finding_id": "bind_reference:6b37dd2d45369241fcd0f685",
      "status": "PREDICTED",
      "source": {
        "file": "CUSTOMERS.xml",
        "module": "CUSTOMERS",
        "block": null,
        "item": null,
        "trigger": null,
        "procedure": null
      },
      "classification": "MANUAL_REVIEW",
      "risk": "UNKNOWN",
      "verdict": "UNKNOWN",
      "evidence": [
        "evidence:2bf52e5a93e6e39d7009b91f",
        "evidence:87096b51def60a1f2d1788c6"
      ],
      "raw_output_ref": "bind_reference:6b37dd2d45369241fcd0f685",
      "notes": "A reference alone cannot establish implementation, ownership or safe reuse."
    },
    {
      "finding_id": "bind_reference:9887d1d1d500ba90ac4e6130",
      "status": "PREDICTED",
      "source": {
        "file": "ORDERS.xml",
        "module": "ORDERS",
        "block": null,
        "item": null,
        "trigger": null,
        "procedure": null
      },
      "classification": "MANUAL_REVIEW",
      "risk": "UNKNOWN",
      "verdict": "UNKNOWN",
      "evidence": [
        "evidence:9f3e33fe550886bb6a558f69",
        "evidence:b9f20fdb5c06989be4f6b86a"
      ],
      "raw_output_ref": "bind_reference:9887d1d1d500ba90ac4e6130",
      "notes": "A reference alone cannot establish implementation, ownership or safe reuse."
    },
    {
      "finding_id": "bind_reference:b24cc185cbec8dc73c073820",
      "status": "PREDICTED",
      "source": {
        "file": "APPROVALS.xml",
        "module": "APPROVALS",
        "block": null,
        "item": null,
        "trigger": null,
        "procedure": null
      },
      "classification": "MANUAL_REVIEW",
      "risk": "UNKNOWN",
      "verdict": "UNKNOWN",
      "evidence": [
        "evidence:19bb7bac59cec3fcc45de943",
        "evidence:b34a8d8c4b9eb16d52af7eef"
      ],
      "raw_output_ref": "bind_reference:b24cc185cbec8dc73c073820",
      "notes": "A reference alone cannot establish implementation, ownership or safe reuse."
    },
    {
      "finding_id": "block:1b5f06d34c7becbac3a3222d",
      "status": "PREDICTED",
      "source": {
        "file": "APPROVALS.xml",
        "module": "APPROVALS",
        "block": "BK_APPROVAL",
        "item": null,
        "trigger": null,
        "procedure": null
      },
      "classification": "CONVERT",
      "risk": "UNKNOWN",
      "verdict": "UNKNOWN",
      "evidence": [
        "evidence:bdb0d05c3bbfd2ca87294075",
        "evidence:9f74b0af4cc0b9f52d1cd5f1"
      ],
      "raw_output_ref": "block:1b5f06d34c7becbac3a3222d",
      "notes": "A Forms2XML component has a modernization mapping to review."
    },
    {
      "finding_id": "block:2e166b9ae5667ffbff835c66",
      "status": "PREDICTED",
      "source": {
        "file": "CUSTOMERS.xml",
        "module": "CUSTOMERS",
        "block": "BK_CUSTOMER",
        "item": null,
        "trigger": null,
        "procedure": null
      },
      "classification": "CONVERT",
      "risk": "UNKNOWN",
      "verdict": "UNKNOWN",
      "evidence": [
        "evidence:44ad6d8a672c214583d6fb3d",
        "evidence:91fe4bbc5b770692cf4b9e99"
      ],
      "raw_output_ref": "block:2e166b9ae5667ffbff835c66",
      "notes": "A Forms2XML component has a modernization mapping to review."
    },
    {
      "finding_id": "block:45619ebea173f1d11795ba88",
      "status": "PREDICTED",
      "source": {
        "file": "ORDERS.xml",
        "module": "ORDERS",
        "block": "BK_ORDER_LINE",
        "item": null,
        "trigger": null,
        "procedure": null
      },
      "classification": "CONVERT",
      "risk": "UNKNOWN",
      "verdict": "UNKNOWN",
      "evidence": [
        "evidence:babeccbb8add7d890bc22401",
        "evidence:323c34b665d7b6aef2f48999"
      ],
      "raw_output_ref": "block:45619ebea173f1d11795ba88",
      "notes": "A Forms2XML component has a modernization mapping to review."
    },
    {
      "finding_id": "block:8c7e218e6f70babe4f0eae70",
      "status": "PREDICTED",
      "source": {
        "file": "INVENTORY.xml",
        "module": "INVENTORY",
        "block": "BK_INVENTORY",
        "item": null,
        "trigger": null,
        "procedure": null
      },
      "classification": "CONVERT",
      "risk": "UNKNOWN",
      "verdict": "UNKNOWN",
      "evidence": [
        "evidence:552fd14c42a593c97c04b580",
        "evidence:b11cf76ddc8fdc4ef145b3bd"
      ],
      "raw_output_ref": "block:8c7e218e6f70babe4f0eae70",
      "notes": "A Forms2XML component has a modernization mapping to review."
    },
    {
      "finding_id": "block:91d631797426eb5b75c6beb6",
      "status": "PREDICTED",
      "source": {
        "file": "ORDERS.xml",
        "module": "ORDERS",
        "block": "BK_ORDER",
        "item": null,